{
  "meta": {
    "slug": "electrica",
    "titulo": "La corriente interrumpida",
    "subtitulo": "El sistema eléctrico cubano: de la electrificación de la isla al apagón permanente",
    "ventana": "1958–2026",
    "actualizado": "2026-07-06",
    "fuentes": [
      "Unión Eléctrica (UNE) vía Cubadebate y Juventud Rebelde",
      "Horizonte Cubano (Columbia Law School)",
      "IEEE Spectrum · Cuba's Energy Crisis (2025)",
      "ONEI vía Diario de Cuba y El Periódico de la Energía",
      "CiberCuba · 14ymedio · elTOQUE · Cubanet · Infobae",
      "Wikipedia · 2024–2026 Cuba blackouts",
      "Banco Mundial · IEA · ICE (Costa Rica) · ONE (Rep. Dominicana)"
    ],
    "nota": "Cifras 'al menos' y con su incertidumbre marcada. Distinción clave: 'termoeléctricas' en sentido estricto (plantas de vapor) generan ~40%; el ~80% fósil solo se alcanza sumando los motores diésel y fuel-oil de la generación distribuida.",
    "descripcion": "Este expediente reconstruye la trayectoria del sistema electroenergético nacional (SEN) de Cuba desde vísperas de 1959 hasta julio de 2026, contrastando lo que se construyó con el estado actual de la red. En 1958 la isla tenía una capacidad instalada de entre 397 y 430 MW y una electrificación del 56% de la población, concentrada en las ciudades; según compilaciones de la época, Cuba figuraba entre los dos primeros países de América Latina en consumo eléctrico por habitante, aunque el ranking exacto (primero o segundo, tras o junto a Argentina) y la cifra per cápita concreta no pudieron verificarse contra la fuente primaria y se dejan como afirmación cualitativa. El 6 de agosto de 1960 el Estado nacionalizó la Compañía Cubana de Electricidad, que suministraba más del 90% de la electricidad vendida en el país. Entre los años sesenta y ochenta, con apoyo soviético, se construyeron la mayoría de las grandes termoeléctricas que aún hoy sostienen el sistema, y en 1992 el SEN alcanzó su pico documentado: 3.676 MW de capacidad interconectada y un 95% de electrificación. La caída de la URSS abrió el Período Especial: sin crudo subvencionado, el mantenimiento se volvió inviable. En 2005 y 2006 la llamada Revolución Energética apostó por miles de grupos electrógenos diésel y fuel-oil distribuidos (entre 2004 y 2020 se importaron más de 73.000), pero el alivio duró apenas unos cinco años. El estado actual es de crisis: la demanda pico ronda los 3.000 MW (rango observado 2.900–3.300), mientras la capacidad realmente disponible fluctúa a diario y se ha reportado desde 1.165 hasta 1.880 MW en 2025 y 2026. El déficit medio de 2025 fue de unos 1.531 MW según Horizonte Cubano (Columbia Law), con picos de hasta 2.054 MW. La producción anual de 2025 fue de 15.918 GWh, alrededor de un 25% por debajo de los 19.071 GWh de 2020, aunque con una leve recuperación frente a 2024 atribuible al aporte solar. La generación térmica fósil (termoeléctricas de vapor más motores diésel y fuel-oil) representa cerca del 80%; la mayor planta, la CTE Antonio Guiteras de Matanzas (330 MW, unos 38 años de explotación), encadenó 17 desconexiones del sistema a comienzos de julio de 2026. La mayoría de las termoeléctricas supera los 30 a 40 años, muy por encima de su vida útil de diseño. Los apagones diarios oscilan entre 12 y 20 horas como suelo, con picos documentados de hasta 30 horas en La Habana y hasta 87 horas continuas en Matanzas, y afectaciones simultáneas de entre el 54% y el 72% del territorio. Entre octubre de 2024 y julio de 2026 el país sufrió al menos seis apagones nacionales totales. La dependencia del combustible importado se agravó: en 2025 México fue el mayor proveedor (~44%), seguido de Venezuela (~34%) y Rusia (~15%), pero Venezuela cortó sus envíos por completo tras la captura de Nicolás Maduro en enero de 2026. La única señal de crecimiento es la solar fotovoltaica, que pasó de unos 298 MW a fin de 2024 a 1.084 MW a fin de 2025, con apoyo chino. El expediente cierra con dos ejercicios interpretativos, marcados como tales: una comparación de instantáneas entre Cuba y dos pares regionales que no vivieron la ruptura de 1959 (República Dominicana, con 5.950 MW instalados y 99,6% de electrificación, y Costa Rica, con 3.658 MW y una matriz más del 95% renovable), y un cálculo ilustrativo del coste de oportunidad de una Cuba con red estable y fiable para alojar centros de datos, sector para el que la fiabilidad de la red, el precio del kWh y la conectividad submarina son decisivos. No se afirma causalidad: la comparación entre países es observacional y las proyecciones son escenarios explícitos, no contabilidad.",
    "narracion": "El sistema eléctrico cubano se construyó en tres décadas y se ha deshecho en una. En 1958 la isla figuraba entre los países latinoamericanos de mayor consumo eléctrico por habitante; en 1992 el sistema alcanzó su pico, tres mil seiscientos setenta y seis megavatios interconectados y el noventa y cinco por ciento del país electrificado. Hoy la demanda pico ronda los tres mil megavatios y la capacidad disponible ha llegado a caer por debajo de mil doscientos: el déficit medio de 2025 superó los mil quinientos megavatios. Los apagones van de doce a veinte horas diarias como suelo, con picos de hasta ochenta y siete horas seguidas en Matanzas, y el país ha sufrido al menos seis apagones nacionales totales desde octubre de 2024. Las termoeléctricas superan los treinta o cuarenta años de edad; la mayor, la Guiteras, encadenó diecisiete desconexiones a comienzos de julio de 2026. El combustible depende de fuera, y Venezuela cortó sus envíos por completo en enero de 2026. La única curva que sube es la solar: de trescientos a más de mil megavatios en un año, con apoyo chino. La red que un día fue vanguardia regional hoy funciona a oscuras; el expediente mide, década a década, cómo se llegó hasta aquí.",
    "narracion_en": "On the eve of 1959, Cuba had an electrical capacity of about four hundred megawatts and reached a little more than half of its population. According to accounts from that era, it ranked among the top two countries in Latin America in electricity consumption per person. In 1960 the state nationalized the Cuban Electric Company, which supplied more than ninety percent of the country's electricity. Between the sixties and the eighties, with Soviet support, nearly all of the large thermoelectric plants that still sustain the grid today were built. In 1992 the system reached its peak: more than three thousand six hundred megawatts of capacity and coverage of ninety-five percent. Then came the collapse. When the Soviet Union fell, cheap oil disappeared and maintenance became impossible. In two thousand five, the government bet on thousands of small diesel plants spread across the island, but the relief lasted barely five years. Today peak demand hovers around three thousand megawatts, while available generation falls many days below two thousand. The average deficit in 2025 was more than one thousand five hundred megawatts, with peaks above two thousand. Annual production ended up close to twenty-five percent below that of 2020. Most plants have been running for more than thirty or forty years, far beyond their designed working life. The largest of them all, the Antonio Guiteras plant in Matanzas, disconnected from the system seventeen times in just the first months of 2026. Daily blackouts run, at a minimum, from twelve to twenty hours, and in some areas they have gone on for more than eighty hours straight. Between October 2024 and July 2026 there were at least six total national blackouts. The only sign of growth is solar power, which went from about three hundred to more than one thousand megawatts in a single year. The file closes with two exercises explicitly marked as interpretive. The first compares Cuba with two neighbors that did not live through the rupture of 1959: the Dominican Republic and Costa Rica, both now far ahead in capacity per person and in grid reliability. The second calculates, as a scenario, how much a Cuba with stable electricity could earn by hosting data centers, a business that demands exactly what is missing today: continuous power, without interruptions. No cause is claimed: the comparison is observational and the figures are a scenario, not an accounting."
  },
  "kpis": [
    { "id": "deficit", "valor": 1550, "sufijo": " MW", "etiqueta": "Déficit medio diario (2025)", "estado": "corroborado" },
    { "id": "apagon", "valor": "12–20+", "sufijo": " h", "etiqueta": "Apagón diario típico", "estado": "corroborado" },
    { "id": "cobertura", "valor": 63, "sufijo": " %", "etiqueta": "Demanda cubierta en pico", "estado": "estimacion" },
    { "id": "solar", "valor": 1084, "sufijo": " MW", "etiqueta": "Solar instalada (fin 2025)", "estado": "corroborado" }
  ],
  "historia": [
    { "anio": 1958, "hito": "Vísperas de 1959: 413 MW y 56% de cobertura", "detalle": "Capacidad instalada de unos 397 a 430 MW y electrificación del 56%, concentrada en las ciudades. Cuba figuraba entre los dos primeros países de América Latina en consumo eléctrico por habitante (ranking exacto no verificado).", "capacidadMW": 413, "electrificacionPct": 56, "fase": "prerevolucion" },
    { "anio": 1960, "hito": "Nacionalización de la Compañía Cubana de Electricidad", "detalle": "El 6 de agosto de 1960 el Estado expropió la Compañía Cubana de Electricidad, que suministraba más del 90% de la electricidad vendida en el país.", "capacidadMW": null, "electrificacionPct": null, "fase": "expansion-sovietica" },
    { "anio": 1975, "hito": "Expansión termoeléctrica con apoyo soviético", "detalle": "Entre los años sesenta y ochenta se construyeron, con apoyo soviético, la mayoría de las grandes termoeléctricas que todavía hoy sostienen el sistema.", "capacidadMW": null, "electrificacionPct": null, "fase": "expansion-sovietica" },